<?xml version="1.0" ?>
<!DOCTYPE SubDeckBlue SYSTEM "blue-deck-schema.dtd">
<SubDeckBlue>
    <CharacterCard name="name" era="1">
        <Requirement>
            <Properties>
                    <Wood value="0"/>
                    <Stones value="2"/>
                    <Servants value="3"/>
                    <Coins value="3"/>
                    <MilitaryPoints value="0"/>
                    <VictoryPoints value="1"/>
                    <FaithPoints value="2"/>
            </Properties>
	    <CardsNumber>
                <Green value="2"/>
		<Yellow value="0"/>                
		<Blue value="0"/>           
                <Purple value="0"/>
            </CardsNumber>
        </Requirement>
 	<Cost>
         <Properties>
                    <Wood value="0"/>
                    <Stones value="2"/>
                    <Servants value="3"/>
                    <Coins value="3"/>
                    <MilitaryPoints value="0"/>
                    <VictoryPoints value="1"/>
                    <FaithPoints value="2"/>
	</Properties>
         </Cost>
	<InstantEffect/>
    </CharacterCard>
</SubDeckBlue>
